tweets,id,len,date,source,likes,retweets,polarity,sentiment,companies
Trey s Subway Cup I had a delightful call with my wife and the staff today and maybe one day you can lose that embarrassing and moronic name,1440816226037481472,166,2021-09-22 23:12:12,TweetDeck,317,17,0.22666666666666666,wpositive,None
i am not allowed to own stock and you are the worst quarterback in the NFL,1440815886395342864,98,2021-09-22 23:10:51,TweetDeck,229,9,0.1,wpositive,None
Do you know why you are nobody important Because you will look back with tremendous regret that you wrote this I feel so sorry for you and your incredible lack of self esteem Jimmy Chill is in the house to say you need help and you need it now Please get help,1440815751309377549,289,2021-09-22 23:10:18,TweetDeck,215,5,0.7,spositive,None
RT Again having taken frequently to task over the decades Congratulations to them on the example they have set i,1440815145907675148,140,2021-09-22 23:07:54,TweetDeck,0,25,0.13636363636363635,wpositive,None
How great is that Unity story I think it is going to be a must own,1440815035350073350,70,2021-09-22 23:07:28,TweetDeck,193,7,0.15,wpositive,None
RT On Thursday Sept 23 at 5 00 p m ET joins to discuss his new book Uncontrolled Spread Why C,1440785209096474629,140,2021-09-22 21:08:57,TweetDeck,0,10,-0.4318181818181818,negative,None
Here s what the primates do when they aren t pumping and dumping the morning dross They see that Gamestop and AMC aren t up much so in the last few minutes they buy a lot of calls so the stocks go higher and they sleep better,1440756278020558858,227,2021-09-22 19:13:59,TweetDeck,427,42,0.0,neutral,None
i know it seems cruel but when i heard about Toast today a new ipo all i could think about was how the apes are toast,1440755953930964995,123,2021-09-22 19:12:42,TweetDeck,703,41,-0.059999999999999984,wnegative,None
time to heckle Jay,1440747432661295115,19,2021-09-22 18:38:50,TweetDeck,213,17,0.0,neutral,None
at least Jay took my solution nice primates Jay is the head of the Federal Reserve which you have to google to learn more about It is never too late to not be stupid,1440741600582242317,171,2021-09-22 18:15:39,TweetDeck,194,7,0.125,wpositive,None
soon we will have another edition of Heckle Jay,1440740213211287560,50,2021-09-22 18:10:09,TweetDeck,74,3,0.0,neutral,None
I will offer a solution for Jay he announces a taper schedule but then says actual rate hikes won t happen for awhile and then the market goes higher,1440737153848254467,151,2021-09-22 17:57:59,TweetDeck,150,6,0.175,wpositive,None
The pressure grows on Jay,1440734201750298628,26,2021-09-22 17:46:15,TweetDeck,126,5,0.0,neutral,None
First Steve spells it with an i like Pompitus Second i heard this interview where he said he made it up and it sounded so good he had to use it How can you not love a guy like that,1440733956274417669,212,2021-09-22 17:45:17,TweetDeck,30,1,-0.29166666666666663,wnegative,None
Bye your Dan You and your primate ilk are getting blown out and are going to be the short timers that i always thought Jimmy Chill is back and he s back with a VENGEANCE,1440733659980468231,198,2021-09-22 17:44:06,TweetDeck,99,4,0.0,neutral,None
As a self proclaimed primatologist I am wondering if the primates know what the fed is Maybe they think it is the past tense of feed,1440730713779703812,134,2021-09-22 17:32:24,TweetDeck,421,19,0.19374999999999998,wpositive,None
Just picked up the fastest man in the NFL Quez Watkins using him big on that WR Screen play,1440729596396126210,103,2021-09-22 17:27:57,TweetDeck,40,3,0.6,positive,None
I loved the people who complain that i recommended Narcan to get rid of their Cramer addiction But they are all going to overdose when they run out of money by over trading options and waiting for Godot oops i mean Gamestop,1440729409506349065,226,2021-09-22 17:27:13,TweetDeck,101,6,-0.10153061224489797,wnegative,None
thanks Prem The haters are on the run because they are running out of money now that the benefits have ended And the ape thing They will soon be like Occupy Wall Street We all know this Everyone is just scared to say it Their best attribute photoshop,1440729165448110093,285,2021-09-22 17:26:15,TweetDeck,55,3,0.5,positive,None
My mother died 40 years ago I miss her You on the other hand are a total moron that i quote just to let everyone know what kind of absolute idiots i have to suffer through to find the smart people,1440728500021850122,226,2021-09-22 17:23:36,TweetDeck,540,13,0.0,neutral,None
hey joker i just started baiting these bozos yesterday My tweets are about 78 stocks 12 garden 4 dogs and the rest clowns like you Moonshoot McGoo Or Mr Magoo i guess Or Moondog Man are you creative and now i have immortalized you as a joker,1440728033283883013,277,2021-09-22 17:21:45,TweetDeck,86,2,0.07500000000000001,wpositive,None
That s why i call you Maurice,1440727313872687110,54,2021-09-22 17:18:53,TweetDeck,81,1,0.13636363636363635,wpositive,None
hilarious you obviously do Sir Apey McDiamondballs or you wouldn t make up such a stupid name and comment on it Does your mommy know you go by McDiamondballs Does she think it is funny Your kids will love that name at school Hoo hah,1440727258902110210,264,2021-09-22 17:18:40,TweetDeck,122,11,0.5,positive,None
RT My new book Uncontrolled Spread Reviewed By Dr Marc Siegel UncontrolledSpread,1440722245572186129,140,2021-09-22 16:58:45,TweetDeck,0,17,0.16666666666666666,wpositive,None
Jay Powell has his work cut out for him with this rally He better say that the fed should stop buying bonds and start buying stocks,1440715388111572998,136,2021-09-22 16:31:30,TweetDeck,517,39,0.2,wpositive,None
RT Why is it such a big deal when a CEO says that if their employees are being targeted they will support them amp offer them safe,1440710692135321609,143,2021-09-22 16:12:50,Twitter for iPhone,0,84,0.08611111111111111,wpositive,None
wow powerful ahead of fed meeting,1440700924201091073,61,2021-09-22 15:34:01,TweetDeck,125,11,0.0,neutral,None
RT Hot off the press After a jam packed first day of DF21 sat down with last night on,1440700122925395970,140,2021-09-22 15:30:50,TweetDeck,0,5,0.8,spositive,None
We called it and so did you,1440692408413347842,52,2021-09-22 15:00:11,TweetDeck,42,4,1.0,spositive,None
this is a great litany of issues,1440691725240979464,56,2021-09-22 14:57:28,TweetDeck,41,5,-0.009595959595959616,wnegative,None
Congratulations You save a company wonderful things happen,1440691586912772104,86,2021-09-22 14:56:55,TweetDeck,2298,302,0.3181818181818182,positive,None
RT The Fed FDX ZM and DKNG breaks down the markets live,1440678249328099328,111,2021-09-22 14:03:55,TweetDeck,0,7,0.029166666666666674,wpositive,None
RT Today on TheStreetLive with The Fed ADBE FDX ZM Much more Stream Live,1440675970239762438,140,2021-09-22 13:54:52,TweetDeck,0,3,-0.051851851851851864,wnegative,None
are people really buying JPM off of Evergrande Give me a break i mean really,1440671813185331203,82,2021-09-22 13:38:21,TweetDeck,105,8,-0.1,wnegative,None
Who is next to be cracked down on in China We can t stand by idly as they go after people for religious reasons and put them in concentration camps or attack gays homophobia rampant,1440668571718148111,182,2021-09-22 13:25:28,TweetDeck,297,34,0.16,wpositive,None
Today s Ape pump and dump scheme is Marin Software Now that they are dwindling in number Planetofthebrokeapes i am going to call out the pump and dumps like this one which is a pathetic outfit w declining revenues,1440632863892774916,218,2021-09-22 11:03:35,TweetDeck,273,18,0.0016666666666666607,wpositive,None
Memo to Coinbase and armstrong still waiting for sketchy behavior of SEC Can you school us on that Why did you withdraw your gameplan Are you the sketchy one,1440623934232096773,171,2021-09-22 10:28:06,TweetDeck,303,45,0.0,neutral,None
time to mortify powell about fed officials trading From now on they should only own treasurys It is not too much to ask Tedious embarrassment headed Jay s way He deserves better,1440623578706178052,182,2021-09-22 10:26:41,TweetDeck,150,16,0.1,wpositive,None
Media set up for hard taper and will bait Powell for an hour of childish Q amp A hoping for a tantrum I remember doing stuff like that in 77 79 with a bunch of actual governors It s lame at best,1440623163012829185,198,2021-09-22 10:25:02,TweetDeck,91,11,0.0,neutral,None
President Xi screwed up on this one He over reached Is his presidency for life on the line,1440622656454213643,117,2021-09-22 10:23:01,TweetDeck,97,17,0.0,neutral,None
Citadel could you please clarify that i don t work for you but others do work through you and have payment arrangements Is it the Apes Another call i will make today Busy day,1440618688550359052,178,2021-09-22 10:07:15,TweetDeck,209,20,0.0,neutral,None
If Apes want to show us your bank accounts and stock holdings then i will re tweet you But showing me a picture of an ape means you are pumping and dumping or working for Citadel,1440618438481694727,180,2021-09-22 10:06:15,TweetDeck,130,15,0.0,neutral,None
The Chinese government bailout we have been waiting for,1440618256646033413,81,2021-09-22 10:05:32,TweetDeck,88,16,0.15,wpositive,None
Lotta mouths to feed though no,1440618102102786054,56,2021-09-22 10:04:55,TweetDeck,16,1,-0.25,wnegative,None
if evergrande says a payment has been resolved that s the PRC saying we accept the moral hazard and won t let bond holders all go under from this,1440617990517497856,146,2021-09-22 10:04:28,TweetDeck,128,12,0.55,positive,None
anyone here worth starting,1440611502055047172,51,2021-09-22 09:38:42,Twitter for iPhone,61,1,0.0,neutral,None
As per usual i intend to ask Gamestop to come on and tell us if it is part of the Metaverse world or part of the mall no one cares about APEGOINGBROKE,1440610858053160962,152,2021-09-22 09:36:08,TweetDeck,125,13,0.3154761904761904,positive,None
I was happy to see Coinbase cave to its own regulator on its decision to add nuclear weapons to the crypto wild west Always good to see fewer ways to lose,1440610532008939531,156,2021-09-22 09:34:50,TweetDeck,52,3,0.0625,wpositive,None
I am puzzled over ZM The idea that FiveNine would be a security risk when combined with Zoom is simply uneducated and fatuous,1440610336390848512,131,2021-09-22 09:34:04,TweetDeck,52,3,0.0,neutral,None
Adobe on the other hand is almost entirely a creature of its own success you need to know that this is a typical summer swoon for this great stock or a great company,1440610051631112192,167,2021-09-22 09:32:56,TweetDeck,45,2,-0.43333333333333335,negative,Adobe
Going over the Fedex call i can see the analysts seething Many had said it would be a weak q But that wasn t it at all It was the guidance for basically nothing Have they lost control of the business,1440609862233194502,207,2021-09-22 09:32:11,TweetDeck,41,3,-0.3,negative,None
I sleep on Tuesday nights,1440601630156607489,49,2021-09-22 08:59:28,TweetDeck,34,1,0.44000000000000006,positive,None
Sadly as i have now learned the manipulation is all on your end and i think that you should separate yourself from this merry band of crooks before you become extinct The pump and dump games are over You aren t leaving you are alas broke,1440601491975270407,269,2021-09-22 08:58:55,TweetDeck,78,8,-0.1875,wnegative,None
By the way if you are calling yourself an ape you can still redeem yourself and try to make money by learning and investing rather than just literally withering on some vine It is not too late to become an investor Don t feel like you are doomed to lose money,1440601073543094277,266,2021-09-22 08:57:15,TweetDeck,379,22,0.0,neutral,None
I know the Apes are leaving because 1 they are out of money and 2 there are now many thoughtful people coming back into my mentions which is great cause i love that,1440600690414407680,167,2021-09-22 08:55:44,TweetDeck,106,3,0.41111111111111115,positive,None
People say why do i go back into the mentions column It is simple the people who call themselves Apes have gotten bored They pump and dump small caps in the morning and wait for Gamestop or AMC to do something They are leaving,1440600551595536387,230,2021-09-22 08:55:11,TweetDeck,41,2,0.0,neutral,None
If i knew who Citadel was or what they did besides being a manager whom i have nothing to do with then i would say maybe But i do videos and their sign happens to be over my head so people think i work for them Just part of the lies of twitter our paths have never crossed,1440600312125935616,300,2021-09-22 08:54:14,TweetDeck,43,2,-0.020833333333333343,wnegative,None
this is a great point i deal directly with larry I thought that IBM call was super,1440599556597579780,111,2021-09-22 08:51:13,TweetDeck,23,1,0.21428571428571427,wpositive,None
i think it is more complicated than that They don t want lack of disclosure They do need to know that say Tether isn t relying on paper connected to Evergrande,1440599183468023817,163,2021-09-22 08:49:45,TweetDeck,36,2,0.2,wpositive,None
Because i have been up for an hour working so it is hardly the first thing i have thought of,1440598916278280203,116,2021-09-22 08:48:41,TweetDeck,32,0,0.0,neutral,None
yeah the engine for certain can t make money off it though,1440598645057806338,90,2021-09-22 08:47:36,TweetDeck,13,0,-0.35,negative,None
thanks for this how about the advertising possibilities Fremium model,1440598529139884039,98,2021-09-22 08:47:09,TweetDeck,13,1,0.10606060606060606,wpositive,None
When you think about building apps in the metaverse what companies come to mind,1440597731785936903,80,2021-09-22 08:43:58,TweetDeck,167,11,0.5,positive,None
the anger is seething AGAIN about Fedex too palpable,1440462380383621129,57,2021-09-21 23:46:08,TweetDeck,110,2,0.3,wpositive,None
initial conclusion on Fedex They have to charge even more They are simply under charging even with the new prices They simply won t make enough money,1440459435030171656,152,2021-09-21 23:34:26,TweetDeck,257,18,-0.14375,wnegative,None
I saw the I phone 13 today It s better,1440457498293522434,66,2021-09-21 23:26:44,TweetDeck,289,27,0.24,wpositive,None
I liked the Planet of the Apes I will miss these Roddy McDowalls now that their numbers are dwindling They will go to the casinos and bet on double zero I suggest reading the Gambler It s all about what the Apes have learned about stocks Will they be up at 3 studying FDX,1440457105899548672,277,2021-09-21 23:25:11,TweetDeck,117,13,0.225,wpositive,None
here s what happens to the apes They have nothing in their empty lives except watching me and tweeting about me They need Narcan But before they are blown out which is what is happening I like to give em a little joshin Soon they will be gone,1440455721208799237,255,2021-09-21 23:19:40,TweetDeck,682,47,0.0,neutral,None
Nah i am having too much fun You see the trick Jimmy is that without them there s not enough excitement for me I feed of their moronic lack of insight Let me have some fun now and then They will be gone soon and then it will be back to just being nice,1440455042109112321,283,2021-09-21 23:16:59,TweetDeck,91,2,-0.15555555555555559,wnegative,None
Mr Joey I lived in my car for six months I had one set of clothes that i wore pretty much every day with baby powder I was rousted repeatedly Jaundiced liver 22 caliber protection for sleeping under bridges What do you even know about being homeless you mountebank,1440454151662538756,298,2021-09-21 23:13:26,TweetDeck,605,27,-0.15000000000000002,wnegative,None
RT Insights on everything from FedEx to Slack to Covid testing to Facebook to Texas abortion law to Robinhood thank you,1440453368279748617,140,2021-09-21 23:10:19,TweetDeck,0,8,1.0,spositive,Facebook
buying adobe on the way down into its Max conference has made you a lot of money over the years,1440453164730241034,95,2021-09-21 23:09:31,TweetDeck,152,5,0.0,neutral,None
thank you Steve Today the morons are running pics of me and the golem and also saying that i am owned by Citadel Guys your bosses will love it when you curse like heathens which is why i am sending them your funniest tweets,1440411520240738304,253,2021-09-21 20:24:02,TweetDeck,110,5,5.551115123125783e-17,wpositive,None
RT So awesome to see that measures w focus on air put into are limiting outbreaks two in 3 weeks With gt 100 000,1440356767867674624,143,2021-09-21 16:46:28,TweetDeck,0,27,-0.009595959595959616,wnegative,None
i got three heroes tonight stay tuned,1440356697428553734,42,2021-09-21 16:46:11,TweetDeck,154,6,0.0,neutral,None
Here s how i feel I let these clowns go on for ages And then i decided to do some work and find out who they were And i have bad news for them Many work at real jobs where employers may not like their threatening my family Bosses tend to be against that behavior Gloves off,1440334936381087754,303,2021-09-21 15:19:43,TweetDeck,309,6,-0.07777777777777779,wnegative,None
RT Evergrand JNJ Crypto and UBER breaks down the markets live,1440334565332058124,117,2021-09-21 15:18:15,TweetDeck,0,12,0.09292929292929293,wpositive,None
I have zero desire to be your friend I will leave that to Jane Goodall However i do like adam aron and how he has kept the balls in the air on AMC,1440334209931878403,172,2021-09-21 15:16:50,TweetDeck,140,11,0.0,neutral,None
about to make a buy for the market has come down enough to pick something up,1440333904150360075,104,2021-09-21 15:15:37,TweetDeck,82,4,0.5,positive,None
I want to make it clear that i now know the mentioners who present me in a heinous way or attack me with the same old same old I know who you are and I will drop by your offices I will bring donuts and pink slips and help place you at a new job more in keeping with your lunacy,1440333330730258438,279,2021-09-21 15:13:20,TweetDeck,432,22,0.25,wpositive,None
If Dr Topol loves it then i need to focus on it,1440332813434118150,73,2021-09-21 15:11:17,TweetDeck,37,3,0.5,positive,None
Here we go again I caught an 8 bagger on Tesla But Officer Muldoon here doesn t know jack about me Marty where do you work Can I speak to your superior Might be enlightening for him that you lie like a rug Hoo hah,1440332113228668938,245,2021-09-21 15:08:30,TweetDeck,69,2,0.7,spositive,Tesla
Yeah Walt knows the truth You take one of my greatest calls and you say i got it wrong,1440331644720717830,112,2021-09-21 15:06:38,TweetDeck,29,1,0.06666666666666667,wpositive,None
RT Today on TheStreetLive with Evergrande JNJ LEN UBER Much more Stream at 11 15am,1440331441955500037,140,2021-09-21 15:05:50,Twitter Web App,0,2,-0.075,wnegative,None
another clown show of the mentioners that i am about to attack on that i am a tool of Citadel I have no idea who Citadel is But if you ask Vlad you would know the truth But serial liars are good at lying,1440331431163531268,208,2021-09-21 15:05:47,TweetDeck,140,18,-0.7,snegative,None
Tesla fell apart after i said sell it Then when it worked its way back i recommended it and had perhaps the biggest his of my career Bill will take you to La Dolce Vita in Bel Mar for some real Calamari and a terrific clam sauce Are you on Or are you a loser,1440331088161742855,290,2021-09-21 15:04:26,TweetDeck,50,3,0.0,neutral,Tesla
thank you J Mapes The mention column is coming back to normal instead of the endless libel and i didn t have to sue anyone I think this is terrific because if i did the people who hide behind names would have to explain to their employers how they can libel me,1440329146039631875,289,2021-09-21 14:56:43,TweetDeck,43,0,-0.4287698412698413,negative,None
The dreaded up opening really painful,1440328627070013447,42,2021-09-21 14:54:39,TweetDeck,217,8,-0.23055555555555554,wnegative,None
My partner has news put us on,1440306495652958225,47,2021-09-21 13:26:42,TweetDeck,83,5,0.2715909090909091,wpositive,None
One other sick thing about these losers They are addicted to me I wish they could go to some serious Cramer rehab but they can t kick the habit Its like when i worked for Ailes hate me or like me they watch me Except i was not an Ailes fan The offense suits me,1440265543336935427,266,2021-09-21 10:43:59,TweetDeck,203,5,-0.46666666666666656,negative,None
Oh and why am i going on the defensive Because my work with Twitter has come up with a hard core group of about 30 losers who have tried to destroy my feed But they do not have two tv shows 20 videos 12 articles a week and stamina They will be gone soon,1440265199009759234,259,2021-09-21 10:42:36,TweetDeck,1034,29,-0.023106060606060585,wnegative,None
Putting Evergrande in a new light Focus on stories like SKIN and ABNB I presented two attractive opportunities and bought small for,1440264863771623424,157,2021-09-21 10:41:17,TweetDeck,76,2,-0.17999999999999997,wnegative,None
So going forward i have some advice for these Cramer works for the bad guys nonsense Sticks and stone may break my bonds but that is why i carry nuclear weapons You short timers are over done and are going to play bingo at sunrise senior living You are the bad guys,1440264282663309315,272,2021-09-21 10:38:58,TweetDeck,256,11,-0.20833333333333334,wnegative,None
There is a new sheriff in town I have watched these people at Robin Hood lose fortunes in options during the first actual downturn They are the bad guys I don t work for anyone other than the people who are worth helping the viewers,1440263738255241222,238,2021-09-21 10:36:48,TweetDeck,793,26,0.125,wpositive,None
this is the kind of nonsense that is so stupid that the Fourth Turning is someone who reminds me of Jack in the latter part of One Flew Over I work for myself You are the bad guys You are the people who came in here and didn t sell Gamestop at 400 when i said to,1440263336524845063,292,2021-09-21 10:35:12,TweetDeck,174,11,-0.08333333333333333,wnegative,None
99 of what Of people who are getting blown out by the day on silly option trades I want you to invest and not get hurt You are a 99 of a shrinking group of people who will be short timers if you don t get off margin and stop trading options endlessly,1440262747443191818,280,2021-09-21 10:32:52,TweetDeck,99,8,0.2,wpositive,None
So they bought last week and that s a good thing Once again you mountebank you trouble me with your intellectual vacation Time to go back to work The whole other side of Apple Amazon Google tells me you have been blown out and should switch to bridge,1440262373177126920,284,2021-09-21 10:31:23,TweetDeck,42,1,0.0,neutral,"Apple, Amazon"
this is funny The blatant shifting got you out ahead of the big selloff Then yesterday i presented Airbnb and SKIN as possibilities You should try to stay focused and not be distracted Your skill set is wanting,1440261956225495058,238,2021-09-21 10:29:43,TweetDeck,40,2,-0.065,wnegative,None
watching this like a haw Thanks,1440261570026635269,69,2021-09-21 10:28:11,TweetDeck,41,4,-0.15555555555555559,wnegative,None
no we cannot I told people to get out ahead of the sell off Now it is my job to figure out when to get in It is your job to turn off the tv if you don t want to know what is going on Try a clicker,1440261335502127104,226,2021-09-21 10:27:15,TweetDeck,214,8,0.22916666666666666,wpositive,None
A big up opening is a curse not a blessing Have to be very careful because those who bought in the abyss yesterday will just flip,1440222300415037440,133,2021-09-21 07:52:09,TweetDeck,645,46,-0.25,wnegative,None
RT Watch with tonight Out CEO sits down with Jim Tune in,1440078560480292883,133,2021-09-20 22:20:58,TweetDeck,0,4,0.0,neutral,None
Memers you will LOVE this show I mean LOVE I am dedicating it to you,1440078467450605573,74,2021-09-20 22:20:36,TweetDeck,506,19,0.1,wpositive,None
ugly day not done Lennar misses delivery guidance Not so hot I need you to stay focused on our negative view,1440057880644702210,118,2021-09-20 20:58:48,TweetDeck,630,30,0.3,wpositive,None
sell signal still in place,1440008159058436099,26,2021-09-20 17:41:13,TweetDeck,1275,92,0.39999999999999997,positive,None
watch this I think that we aren t ready yet for this from Tesla or anyone else and i think Tesla is terrific,1439971151497900043,134,2021-09-20 15:14:10,TweetDeck,91,8,-0.25,wnegative,Tesla
Has WYNN bottomed If you just close Macau could it be worth 80 Yes if you were trying to rebuild it,1439970795778883588,104,2021-09-20 15:12:45,TweetDeck,144,8,0.3,wpositive,None
this is a really great graph thanks so much,1439970579575152640,74,2021-09-20 15:11:54,TweetDeck,47,2,0.10000000000000002,wpositive,None
i think two expansions of steel plants does not a top make,1439970426298503169,85,2021-09-20 15:11:17,TweetDeck,19,0,0.0,neutral,None
Love Tom too early,1439970218919530496,43,2021-09-20 15:10:28,TweetDeck,177,6,-0.009595959595959616,wnegative,None
wow i really like this list I think it is totally doable,1439970055484231686,81,2021-09-20 15:09:49,TweetDeck,94,13,0.0,neutral,None
Talking crypto and younger investors tonight,1439969965583515651,45,2021-09-20 15:09:27,TweetDeck,585,33,-0.06666666666666667,wnegative,None
RT The Market Selloff Evergrande and PFE breaks down the markets live,1439953400590966785,122,2021-09-20 14:03:38,TweetDeck,0,13,0.75,spositive,None
RT Today on TheStreetLive with The market selloff Evergrande Debt ceiling talks The upcoming Fed meeting,1439948961582927875,140,2021-09-20 13:46:00,TweetDeck,0,3,-0.205,wnegative,None
our buy point had been the second week of October after a harsh decline that we predicted starting last week Freshening things up today But double loss eagles and FF weighing heavily,1439895290262208513,190,2021-09-20 10:12:43,TweetDeck,200,16,-0.13333333333333328,wnegative,None
Yep it comes all the way around whether the win or lose to have my daughter with me makes it all good,1439886115176124416,137,2021-09-20 09:36:16,TweetDeck,93,3,0.2,wpositive,None
Brutal morning but to be expected remember we are in the seasonally weakest moment of the year and we have the PRC s first big common prosperity test,1439885459442786307,156,2021-09-20 09:33:39,TweetDeck,768,65,0.0,neutral,None
